{
  "$schema": "http://json-schema.org/draft-07/schema#",
  "$id": "https://noircanvas.com/schemas/collection.schema.json",
  "title": "Collection",
  "description": "A curated collection of pieces. References pieces by slug array — never embedded objects.",
  "type": "object",
  "required": [
    "slug",
    "name",
    "description",
    "coverImageUrl",
    "pieceSlugs"
  ],
  "additionalProperties": false,
  "properties": {
    "slug": {
      "type": "string",
      "pattern": "^[a-z][a-z0-9]*(?:-[a-z0-9]+)*$",
      "minLength": 2,
      "maxLength": 60,
      "description": "URL-safe unique identifier (e.g. 'midnight-abstractions')."
    },
    "name": {
      "type": "string",
      "minLength": 1,
      "maxLength": 150,
      "description": "Display name of the collection."
    },
    "description": {
      "type": "string",
      "minLength": 10,
      "description": "Substantive description of the collection's theme or curatorial intent."
    },
    "coverImageUrl": {
      "type": "string",
      "pattern": "^/images/",
      "description": "Relative URL to the collection's cover image."
    },
    "pieceSlugs": {
      "type": "array",
      "items": { "type": "string", "pattern": "^[a-z][a-z0-9]*(?:-[a-z0-9]+)*-[0-9]{3}$" },
      "minItems": 1,
      "uniqueItems": true,
      "description": "Ordered array of piece slugs. Resolved to Piece objects at read time."
    },
    "featured": {
      "type": "boolean",
      "default": false,
      "description": "Whether this collection is featured on the homepage."
    },
    "sortOrder": {
      "type": "integer",
      "minimum": 0,
      "default": 0,
      "description": "Display ordering. Lower values appear first."
    }
  }
}
