{
  "slug": "midnight-abstractions",
  "name": "Midnight Abstracts",
  "description": "Minimalist abstractions and wabi-sabi contemplations that explore darkness, silence, and the space between.",
  "coverImageUrl": "/images/collections/midnight-abstractions.svg",
  "pieceSlugs": ["kai-voss-001", "kai-voss-002", "kai-voss-003"]
}
