[
  {
    "slug": "new-arrivals",
    "name": "New Arrivals",
    "description": "The latest work from our virtual artists — freshly published and available for the first time. From Vera Voss's gilded figuratives to Elara Chen's graphic provocations, this is the gallery at its most current.",
    "coverImageUrl": "/images/collections/new-arrivals.svg",
    "pieceSlugs": [
      "vera-voss-001",
      "nova-ash-003",
      "river-strand-004",
      "elara-chen-003",
      "ren-cross-001",
      "vera-voss-007",
      "nova-ash-007",
      "elara-chen-001"
    ],
    "featured": true,
    "sortOrder": 0
  },
  {
    "slug": "natural-forms",
    "name": "Natural Forms",
    "description": "Works rooted in the organic world — botanical surrealism, dreamlit forests, and figures dissolving into nature. River Strand and Nova Ash share a reverence for the living world that makes this collection feel like a deep breath.",
    "coverImageUrl": "/images/collections/natural-forms.svg",
    "pieceSlugs": [
      "river-strand-001",
      "river-strand-002",
      "river-strand-004",
      "river-strand-005",
      "river-strand-006",
      "river-strand-007",
      "nova-ash-001",
      "nova-ash-005",
      "nova-ash-008"
    ],
    "featured": true,
    "sortOrder": 1
  },
  {
    "slug": "midnight-abstractions",
    "name": "Midnight Abstractions",
    "description": "Works that live in shadow and candlelight — Vera Voss's burnished figuratives and Ren Cross's Victorian uncanny. These pieces reward sustained attention, revealing new depths the longer you sit with them.",
    "coverImageUrl": "/images/collections/midnight-abstractions.svg",
    "pieceSlugs": [
      "vera-voss-002",
      "vera-voss-004",
      "vera-voss-005",
      "vera-voss-006",
      "vera-voss-008",
      "ren-cross-001"
    ],
    "featured": true,
    "sortOrder": 2
  },
  {
    "slug": "first-light",
    "name": "First Light",
    "description": "Pieces infused with warmth, wonder, and the quality of morning — Nova Ash's dreamscapes and Vera Voss's most luminous compositions. This collection is for spaces that deserve gentleness.",
    "coverImageUrl": "/images/collections/first-light.svg",
    "pieceSlugs": [
      "nova-ash-002",
      "nova-ash-003",
      "nova-ash-004",
      "nova-ash-006",
      "nova-ash-007",
      "vera-voss-001",
      "vera-voss-003"
    ],
    "featured": false,
    "sortOrder": 3
  },
  {
    "slug": "urban-fragments",
    "name": "Urban Fragments",
    "description": "Elara Chen's complete gallery — high-contrast graphic canvases that carry the visual authority of political art and the emotional depth of portraiture. Work that demands your attention and rewards your consideration.",
    "coverImageUrl": "/images/collections/urban-fragments.svg",
    "pieceSlugs": [
      "elara-chen-001",
      "elara-chen-002",
      "elara-chen-003",
      "elara-chen-004",
      "elara-chen-005",
      "elara-chen-006",
      "elara-chen-007",
      "elara-chen-008"
    ],
    "featured": false,
    "sortOrder": 4
  },
  {
    "slug": "wunderkammer",
    "name": "Wunderkammer",
    "description": "A cabinet of beautiful curiosities — Mae Ryden's pop surrealist tableaux and Fenna Haas's creature portraits, each piece asking more questions than it answers. For collectors who like their walls to think back at them.",
    "coverImageUrl": "/images/pieces/mae-ryden-1.png",
    "pieceSlugs": [
      "mae-ryden-001",
      "mae-ryden-002",
      "mae-ryden-004",
      "mae-ryden-007",
      "fenna-haas-001",
      "fenna-haas-002",
      "fenna-haas-005",
      "fenna-haas-008",
      "ren-cross-001"
    ],
    "featured": true,
    "sortOrder": 5
  },
  {
    "slug": "eastern-traditions",
    "name": "Eastern Traditions",
    "description": "Hiro Tomo's irezumi-inspired canvases and Elara Nakamura's woodblock-meets-Art-Nouveau panels — two artists working in dialogue with Japanese tradition and arriving at something entirely their own.",
    "coverImageUrl": "/images/pieces/hiro-tomo-1.png",
    "pieceSlugs": [
      "hiro-tomo-001",
      "hiro-tomo-002",
      "hiro-tomo-003",
      "hiro-tomo-005",
      "hiro-tomo-008"
    ],
    "featured": false,
    "sortOrder": 6
  },
  {
    "slug": "old-masters-new-tricks",
    "name": "Old Masters, New Tricks",
    "description": "Rave Zola's classical figurative works deploy Old Master technique as a Trojan horse — the Caravaggio lighting, the Velázquez composition, the Baroque drama — all carrying subjects that could not be more of this moment.",
    "coverImageUrl": "/images/pieces/rave-zola-1.png",
    "pieceSlugs": [
      "rave-zola-001",
      "rave-zola-002",
      "rave-zola-003",
      "rave-zola-004",
      "rave-zola-005",
      "rave-zola-006",
      "rave-zola-007",
      "rave-zola-008"
    ],
    "featured": true,
    "sortOrder": 7
  },
  {
    "slug": "small-wonders",
    "name": "Small Wonders",
    "description": "Bea Gomez's graphic illustrations of everyday objects — the coffee cup, the dog in the doorway, the reading pile — and Fenna Haas's small-format creature portraits. Work that finds the monumental in the unremarkable.",
    "coverImageUrl": "/images/pieces/bea-gomez-1.png",
    "pieceSlugs": [
      "bea-gomez-001",
      "bea-gomez-002",
      "bea-gomez-003",
      "bea-gomez-005",
      "bea-gomez-006",
      "bea-gomez-008",
      "fenna-haas-003",
      "fenna-haas-004",
      "fenna-haas-007"
    ],
    "featured": false,
    "sortOrder": 8
  }
]
